,Id,pcode,rate,title
0,id,NOW-01841,4,"Now Foods, Super Omega 3-6-9, 1,200 mg, 180 Softgels"
1,id,NWY-15685,4,"Nature's Way, Alive! 하루에 한 번, 남성을 위한 복합 비타민, 60 정"
2,id,DRB-00373,5,"Doctor's Best, 비오틴, 10,000 mcg, 120 야채 캡슐"
3,id,CGN-01097,3,"California Gold Nutrition, EuroHerbs, Milk Thistle Extract, 80% Silymarin, 175 mg, 60 Veggie Caps"
4,id,MSC-71049,5,"Muscletech, Nitro Tech, 100% 유청 골드, 유청 단백질 분말, 더블 리치 초콜릿, 2.51 kg(5.53 lbs)"
5,id,MSF-71702,5,"MusclePharm, Combat, 100% 유청 단백질, 초콜릿 우유, 2269 g(5 lbs)"
6,id,NOW-00474,5,"Now Foods, 바이오틴, 5,000mcg, 식물성 캡슐 120정"
7,id,NTL-05396,5,"Natrol, 바이오틴, 최대 효능, 10,000mcg, 100정"
8,id,DRB-00263,3,"Doctor's Best, Peptan 함유 콜라겐 타입 1 및 3,500mg, 캡슐 240정"
9,id,CGN-00965,5,"California Gold Nutrition, LactoBif 프로바이오틱, 300억 CFU, 60 식물성 캡슐"
10,id,NOW-04777,5,"Now Foods, 마카, 생식, 750 mg, 90 식물성 캡슐"
11,id,NOW-00077,5,"Now Foods, L-Cysteine, 500 mg, 100 Tablets"
